{"format":"qontext-pool/1","backend":"aer simulator (noisy)","simulated":true,"job_ids":["a8eef41b-96cf-4769-a6f4-5ad2595cb509"],"created":"2026-10-11T15:08:30+00:00","shots":512,"state_seed":7,"contexts":{"R1":[[1,1,1],[-1,1,-1],[1,-1,1],[1,-1,-1],[1,-1,1],[1,-1,-1],[1,1,1],[-1,1,1],[1,1,1],[1,-1,-1],[-1,1,-1],[-1,1,-1],[1,-1,-1],[-1,-1,1],[-1,1,-1],[-1,-1,1],[1,-1,-1],[-1,1,-1],[1,-1,-1],[-1,-1,1],[1,1,1],[-1,-1,1],[-1,1,-1],[-1,1,-1],[1,-1,-1],[1,1,1],[-1,1,-1],[1,1,1],[-1,1,-1],[1,1,1],[-1,1,1],[-1,-1,1],[-1,-1,1],[1,1,1],[-1,1,-1],[-1,1,-1],[1,-1,1],[1,1,1],[1,1,1],[-1,1,-1],[1,1,1],[1,-1,-1],[1,-1,-1],[1,1,1],[-1,1,1],[-1,1,-1],[1,1,1],[1,1,1],[1,1,1],[-1,-1,-1],[-1,1,-1],[-1,1,-1],[-1,-1,1],[-1,1,-1],[-1,-1,1],[-1,1,-1],[1,-1,-1],[-1,1,-1],[1,1,1],[1,-1,-1],[1,1,1],[-1,1,-1],[1,-1,1],[1,1,1],[-1,1,-1],[1,-1,-1],[1,1,-1],[1,-1,-1],[-1,-1,1],[-1,1,-1],[1,1,1],[1,1,1],[1,-1,-1],[-1,1,1],[1,1,-1],[-1,-1,1],[-1,-1,1],[-1,-1,-1],[1,1,1],[1,1,1],[-1,1,-1],[1,1,1],[1,-1,-1],[1,1,1],[1,-1,-1],[1,1,1],[-1,1,-1],[1,-1,-1],[-1,1,-1],[1,1,1],[1,1,1],[1,1,1],[1,-1,-1],[1,1,1],[1,1,1],[1,1,1],[-1,1,-1],[-1,1,-1],[1,1,1],[1,1,1],[-1,1,-1],[1,1,-1],[-1,1,-1],[1,1,1],[1,-1,-1],[-1,1,-1],[-1,-1,1],[-1,-1,1],[-1,1,-1],[-1,1,-1],[1,1,1],[-1,1,-1],[-1,-1,1],[-1,-1,1],[-1,1,-1],[1,-1,-1],[1,-1,-1],[1,1,1],[1,1,1],[-1,1,-1],[1,-1,1],[1,1,1],[1,1,1],[1,1,-1],[1,-1,-1],[1,1,1],[-1,-1,1],[1,-1,-1],[-1,1,-1],[1,1,1],[1,-1,-1],[-1,1,-1],[-1,1,-1],[1,1,1],[-1,-1,1],[1,-1,-1],[1,1,1],[1,1,1],[-1,1,-1],[1,-1,-1],[1,-1,-1],[1,-1,-1],[-1,1,-1],[1,-1,-1],[-1,1,-1],[1,1,1],[-1,-1,1],[1,-1,-1],[-1,1,-1],[1,1,1],[-1,1,-1],[1,-1,-1],[-1,1,-1],[-1,-1,1],[-1,-1,1],[1,1,1],[1,1,1],[-1,1,-1],[1,-1,-1],[1,1,1],[1,1,1],[1,1,1],[-1,1,-1],[1,1,1],[-1,-1,1],[-1,1,1],[-1,1,-1],[-1,-1,-1],[1,-1,-1],[1,-1,-1],[-1,1,-1],[1,1,1],[-1,-1,1],[1,1,1],[1,1,1],[-1,-1,1],[1,1,1],[-1,1,-1],[1,-1,-1],[1,1,1],[1,1,1],[1,-1,-1],[1,-1,-1],[1,1,1],[1,1,1],[-1,1,-1],[1,1,1],[1,-1,-1],[1,1,1],[1,-1,-1],[1,1,1],[-1,1,1],[1,-1,-1],[1,1,1],[1,-1,-1],[1,-1,-1],[-1,1,-1],[1,-1,-1],[1,-1,-1],[-1,1,-1],[1,1,1],[1,1,1],[1,1,1],[1,-1,-1],[-1,-1,1],[1,-1,1],[1,1,1],[1,1,1],[-1,1,1],[1,1,1],[-1,-1,1],[-1,1,1],[-1,-1,1],[1,1,1],[-1,-1,-1],[-1,1,1],[1,1,1],[-1,1,-1],[-1,-1,-1],[1,1,1],[1,1,1],[1,-1,-1],[-1,1,-1],[1,1,1],[-1,1,-1],[-1,-1,1],[1,-1,-1],[1,1,1],[1,1,1],[-1,1,-1],[1,-1,-1],[-1,1,-1],[-1,1,-1],[-1,1,-1],[-1,-1,1],[1,1,1],[1,1,1],[-1,1,1],[1,1,1],[1,1,1],[-1,-1,1],[1,1,1],[-1,1,-1],[1,1,1],[1,1,1],[-1,-1,1],[-1,-1,-1],[1,-1,-1],[1,1,1],[1,1,1],[1,-1,-1],[1,1,1],[-1,1,-1],[-1,1,-1],[1,-1,-1],[-1,1,1],[-1,1,-1],[1,-1,-1],[1,1,-1],[1,1,1],[1,-1,1],[1,1,1],[1,1,1],[1,1,-1],[-1,1,1],[1,1,1],[-1,1,-1],[-1,1,-1],[1,1,1],[1,-1,-1],[1,-1,-1],[1,-1,-1],[-1,-1,1],[1,-1,-1],[1,1,1],[1,1,-1],[-1,1,-1],[-1,-1,1],[-1,-1,1],[1,1,1],[-1,-1,1],[-1,-1,1],[1,1,1],[1,1,1],[1,1,1],[-1,-1,1],[1,1,1],[-1,-1,1],[1,1,1],[1,1,-1],[-1,-1,1],[1,1,1],[-1,1,-1],[1,1,1],[1,1,1],[-1,1,-1],[-1,1,-1],[1,1,1],[-1,-1,1],[1,1,1],[1,-1,-1],[1,1,1],[1,1,-1],[-1,-1,1],[1,-1,-1],[1,1,1],[1,1,1],[-1,-1,-1],[-1,-1,1],[-1,1,-1],[1,-1,-1],[1,-1,-1],[1,1,1],[1,-1,-1],[1,-1,-1],[1,-1,-1],[-1,1,-1],[-1,1,1],[-1,-1,1],[-1,1,-1],[-1,1,-1],[1,1,1],[1,1,1],[1,1,1],[1,-1,-1],[1,-1,-1],[1,1,1],[1,1,1],[1,-1,-1],[1,1,1],[-1,-1,1],[1,1,1],[1,1,1],[1,-1,-1],[-1,1,-1],[1,1,1],[1,-1,-1],[1,1,1],[1,1,1],[1,-1,-1],[-1,1,-1],[-1,-1,-1],[-1,1,-1],[1,1,1],[1,1,1],[-1,-1,1],[-1,1,-1],[1,-1,-1],[1,1,1],[-1,1,-1],[1,1,1],[1,-1,-1],[1,1,1],[1,1,1],[1,-1,-1],[-1,-1,1],[-1,1,-1],[-1,1,-1],[-1,-1,1],[1,1,1],[1,-1,-1],[1,-1,-1],[1,1,1],[-1,1,-1],[1,-1,-1],[-1,1,-1],[-1,-1,1],[-1,1,-1],[-1,-1,1],[1,1,1],[-1,1,-1],[-1,1,-1],[1,-1,-1],[1,-1,1],[1,-1,-1],[1,1,1],[1,1,1],[1,1,1],[-1,-1,1],[1,-1,1],[1,-1,-1],[1,1,1],[1,-1,-1],[-1,-1,1],[1,1,1],[-1,1,-1],[1,-1,-1],[1,1,1],[1,1,1],[-1,1,-1],[-1,1,-1],[1,1,1],[1,1,1],[1,1,1],[-1,-1,1],[-1,-1,1],[1,-1,-1],[-1,1,-1],[-1,1,1],[1,-1,-1],[-1,1,-1],[-1,1,-1],[1,1,-1],[1,1,1],[1,1,1],[-1,1,-1],[1,1,1],[1,-1,-1],[-1,-1,-1],[-1,-1,1],[1,1,1],[1,-1,-1],[1,1,1],[-1,-1,1],[1,-1,1],[1,1,-1],[1,-1,-1],[1,-1,-1],[1,-1,-1],[1,1,1],[1,1,1],[1,1,1],[1,1,1],[1,1,-1],[1,1,1],[1,1,1],[1,-1,-1],[1,1,1],[1,1,1],[-1,-1,1],[1,-1,-1],[1,-1,-1],[1,1,1],[1,-1,-1],[1,-1,-1],[-1,-1,1],[1,1,1],[1,-1,-1],[-1,1,-1],[-1,-1,1],[1,1,1],[-1,1,-1],[1,1,1],[-1,1,-1],[1,1,1],[1,1,1],[1,1,1],[-1,-1,1],[1,1,-1],[1,-1,-1],[-1,1,-1],[-1,-1,1],[-1,1,-1],[-1,1,-1],[1,1,1],[-1,-1,1],[1,1,1],[1,1,1],[-1,1,-1],[1,-1,-1],[1,-1,1],[-1,-1,1],[-1,-1,1],[1,-1,-1],[1,1,1],[1,-1,-1],[1,-1,-1],[-1,-1,1],[1,-1,-1],[1,-1,1],[-1,-1,1],[-1,-1,1],[1,1,1],[1,1,1],[1,-1,-1],[-1,1,1],[1,-1,-1],[1,-1,-1],[-1,-1,1],[1,1,1],[-1,-1,1],[1,1,1],[1,1,1],[1,-1,-1],[1,-1,-1],[1,-1,-1],[1,-1,-1],[-1,1,-1],[-1,1,-1],[1,-1,-1],[-1,-1,1],[-1,-1,1],[-1,1,1],[1,1,1],[1,1,1],[-1,1,-1],[1,1,1],[1,-1,-1],[1,1,1],[-1,-1,1],[1,1,1],[1,-1,-1],[1,1,1],[-1,-1,1],[1,1,1],[-1,-1,1],[1,-1,-1],[-1,-1,1],[1,1,1],[1,-1,-1],[-1,1,-1],[-1,-1,-1]],"R2":[[1,-1,-1],[-1,1,-1],[-1,1,-1],[1,-1,-1],[1,-1,-1],[1,-1,-1],[1,-1,-1],[1,-1,-1],[1,-1,-1],[-1,1,-1],[1,-1,-1],[1,1,1],[1,-1,-1],[-1,-1,-1],[1,-1,-1],[1,-1,-1],[-1,-1,-1],[1,-1,-1],[1,1,1],[-1,1,-1],[-1,1,-1],[1,-1,-1],[1,-1,-1],[-1,1,-1],[1,-1,-1],[-1,1,-1],[1,-1,-1],[-1,1,-1],[1,-1,-1],[-1,1,1],[-1,1,-1],[1,-1,-1],[1,1,1],[-1,1,-1],[-1,1,-1],[1,1,-1],[1,-1,-1],[1,-1,-1],[1,-1,-1],[1,-1,-1],[1,-1,-1],[1,1,1],[1,-1,-1],[1,-1,-1],[-1,1,-1],[1,1,1],[1,-1,-1],[-1,-1,-1],[-1,1,-1],[1,-1,-1],[1,-1,-1],[-1,1,-1],[-1,1,-1],[1,-1,-1],[1,-1,-1],[-1,1,-1],[-1,1,-1],[-1,1,-1],[1,-1,1],[1,-1,-1],[1,-1,-1],[1,-1,-1],[1,-1,-1],[1,-1,-1],[-1,-1,-1],[1,-1,-1],[-1,1,-1],[-1,1,-1],[-1,1,-1],[1,-1,-1],[1,-1,-1],[1,-1,-1],[1,-1,-1],[1,-1,-1],[1,-1,-1],[1,1,-1],[-1,1,-1],[1,-1,-1],[1,-1,-1],[1,-1,-1],[1,-1,-1],[1,-1,-1],[1,-1,-1],[1,-1,-1],[1,-1,-1],[1,-1,1],[1,-1,-1],[1,-1,-1],[-1,1,-1],[1,-1,-1],[1,-1,-1],[1,-1,-1],[1,1,1],[-1,-1,-1],[1,-1,-1],[-1,1,-1],[-1,1,-1],[1,1,1],[1,-1,-1],[-1,1,1],[-1,-1,-1],[1,1,1],[-1,1,-1],[1,-1,-1],[-1,1,-1],[-1,1,-1],[-1,1,-1],[1,-1,-1],[1,-1,-1],[1,-1,1],[-1,1,-1],[-1,1,-1],[1,-1,-1],[1,-1,-1],[1,-1,-1],[-1,1,-1],[-1,1,-1],[-1,1,-1],[-1,1,1],[-1,1,-1],[1,-1,-1],[1,1,-1],[-1,1,-1],[-1,1,-1],[-1,-1,-1],[1,1,1],[-1,1,-1],[1,-1,-1],[-1,1,-1],[1,-1,-1],[-1,1,1],[1,-1,-1],[1,-1,-1],[1,-1,-1],[-1,1,-1],[1,-1,-1],[-1,1,-1],[-1,1,-1],[-1,1,-1],[-1,1,-1],[-1,1,-1],[1,-1,-1],[1,-1,1],[-1,1,-1],[1,-1,-1],[-1,1,1],[1,-1,-1],[1,-1,-1],[1,-1,-1],[1,-1,-1],[-1,1,-1],[-1,1,-1],[1,-1,-1],[1,-1,-1],[1,-1,-1],[1,-1,-1],[-1,1,1],[1,-1,-1],[1,-1,-1],[1,-1,-1],[1,-1,-1],[-1,-1,1],[1,-1,-1],[1,-1,1],[1,-1,-1],[1,-1,-1],[1,-1,-1],[1,-1,-1],[-1,1,-1],[-1,1,-1],[1,-1,-1],[1,-1,-1],[1,-1,-1],[1,-1,1],[1,1,-1],[1,-1,-1],[-1,1,-1],[1,-1,-1],[1,-1,-1],[1,-1,-1],[1,-1,-1],[1,-1,-1],[1,-1,-1],[-1,-1,1],[1,1,-1],[1,-1,-1],[1,1,1],[1,-1,-1],[-1,-1,1],[-1,1,-1],[1,-1,-1],[1,-1,-1],[1,1,1],[-1,-1,-1],[1,1,1],[1,-1,-1],[1,-1,-1],[1,-1,-1],[-1,1,-1],[1,-1,-1],[1,-1,-1],[1,1,1],[-1,1,-1],[1,-1,-1],[1,1,1],[1,-1,-1],[1,-1,-1],[-1,1,-1],[-1,1,-1],[1,-1,-1],[-1,-1,1],[1,-1,-1],[1,-1,-1],[1,-1,-1],[-1,1,-1],[-1,1,-1],[1,-1,1],[-1,1,-1],[-1,1,-1],[1,-1,-1],[1,-1,-1],[1,1,-1],[1,-1,-1],[1,-1,-1],[-1,1,-1],[-1,1,1],[-1,1,-1],[1,1,-1],[1,-1,-1],[1,-1,-1],[-1,1,-1],[1,-1,-1],[-1,1,-1],[-1,1,-1],[1,-1,-1],[1,-1,-1],[1,1,1],[1,-1,1],[1,-1,-1],[-1,-1,-1],[1,-1,-1],[1,-1,-1],[1,-1,-1],[1,-1,-1],[-1,1,-1],[1,-1,-1],[1,-1,-1],[-1,1,-1],[1,1,1],[-1,-1,1],[1,-1,-1],[1,-1,-1],[1,-1,-1],[1,-1,-1],[-1,1,-1],[1,-1,-1],[1,-1,-1],[1,1,-1],[1,1,1],[1,-1,-1],[-1,1,-1],[-1,1,-1],[1,-1,-1],[1,-1,-1],[1,-1,1],[1,-1,-1],[1,-1,-1],[1,1,1],[-1,1,-1],[1,-1,-1],[1,-1,-1],[1,-1,-1],[-1,1,-1],[-1,1,-1],[1,-1,-1],[1,-1,-1],[1,-1,-1],[1,-1,-1],[1,-1,-1],[1,1,1],[1,-1,-1],[-1,1,1],[1,-1,-1],[-1,1,1],[-1,1,-1],[1,-1,-1],[-1,1,-1],[1,-1,-1],[1,-1,-1],[-1,1,-1],[1,-1,-1],[1,1,1],[-1,1,-1],[1,-1,-1],[1,1,-1],[1,1,-1],[1,-1,1],[1,-1,-1],[1,-1,-1],[1,-1,-1],[1,-1,-1],[1,-1,-1],[1,1,1],[-1,1,-1],[-1,1,-1],[1,-1,-1],[1,-1,-1],[1,-1,-1],[1,1,1],[1,-1,1],[1,-1,-1],[1,-1,-1],[1,1,1],[1,1,1],[1,1,1],[1,-1,-1],[1,-1,-1],[-1,1,-1],[-1,1,-1],[-1,1,-1],[1,-1,-1],[1,-1,-1],[1,-1,-1],[1,-1,-1],[-1,-1,1],[1,-1,-1],[1,-1,-1],[1,-1,1],[1,-1,-1],[-1,1,-1],[-1,1,-1],[1,-1,-1],[1,1,1],[1,-1,-1],[1,-1,-1],[-1,1,-1],[1,-1,-1],[-1,1,-1],[1,1,-1],[1,-1,-1],[-1,1,-1],[1,-1,-1],[1,-1,-1],[1,1,1],[1,-1,-1],[1,-1,-1],[1,-1,-1],[-1,1,-1],[1,-1,1],[-1,1,-1],[1,1,1],[1,-1,-1],[1,-1,-1],[1,-1,-1],[1,-1,-1],[1,-1,-1],[1,-1,-1],[1,1,1],[-1,1,-1],[1,-1,-1],[1,-1,-1],[1,-1,-1],[1,1,1],[1,-1,-1],[-1,1,-1],[1,-1,-1],[-1,1,-1],[1,-1,-1],[1,-1,-1],[1,-1,-1],[-1,1,-1],[1,1,1],[1,-1,-1],[1,-1,-1],[-1,1,1],[1,-1,-1],[1,-1,-1],[-1,1,-1],[-1,1,-1],[-1,1,-1],[1,-1,-1],[-1,1,-1],[1,-1,-1],[1,1,1],[1,-1,-1],[1,-1,-1],[1,-1,1],[1,1,1],[-1,1,-1],[1,-1,-1],[1,-1,-1],[1,-1,-1],[1,-1,-1],[1,1,1],[1,1,-1],[1,-1,-1],[1,-1,-1],[-1,1,-1],[1,-1,-1],[1,-1,-1],[-1,1,-1],[1,1,1],[1,-1,1],[1,-1,-1],[1,1,1],[1,1,-1],[1,-1,-1],[1,1,-1],[1,-1,-1],[-1,1,-1],[1,-1,-1],[1,1,-1],[1,-1,1],[1,-1,-1],[1,-1,-1],[1,-1,-1],[1,1,1],[1,1,1],[1,-1,-1],[-1,1,-1],[1,-1,-1],[1,-1,1],[1,-1,-1],[1,-1,-1],[1,1,1],[-1,1,1],[1,-1,-1],[1,-1,-1],[1,-1,-1],[1,-1,-1],[1,-1,-1],[1,-1,-1],[1,1,-1],[1,-1,-1],[1,-1,-1],[-1,1,-1],[1,-1,-1],[1,-1,-1],[1,-1,-1],[1,-1,1],[1,-1,-1],[-1,-1,-1],[1,-1,-1],[1,-1,-1],[1,-1,-1],[-1,1,-1],[1,-1,-1],[1,-1,-1],[1,-1,-1],[1,-1,-1],[1,-1,-1],[1,-1,-1],[1,1,1],[1,1,-1],[-1,1,-1],[1,-1,-1],[1,-1,-1],[-1,1,-1],[-1,1,-1],[1,-1,-1],[1,1,-1],[-1,-1,1],[1,-1,1],[1,1,1],[-1,1,-1],[1,-1,-1],[1,-1,-1],[1,-1,-1],[1,1,1],[1,-1,-1],[1,-1,-1],[-1,1,-1],[-1,1,1],[-1,1,-1],[1,-1,-1],[1,-1,-1],[1,-1,-1],[-1,1,-1],[1,-1,-1],[1,-1,-1],[1,-1,-1],[1,-1,-1],[1,-1,-1],[1,-1,-1],[1,-1,-1],[1,1,1],[-1,1,-1],[1,-1,-1],[-1,1,-1],[1,1,1],[1,-1,-1],[-1,1,-1],[1,-1,-1],[1,-1,-1],[1,-1,-1],[1,-1,-1],[1,-1,-1],[1,-1,-1],[1,-1,-1],[1,-1,-1],[-1,1,-1],[-1,1,-1],[1,-1,-1],[1,-1,-1],[1,-1,-1],[1,-1,-1],[-1,1,-1],[1,1,1],[1,1,1],[1,-1,-1],[-1,1,-1],[1,-1,-1]],"R3":[[1,-1,-1],[1,1,1],[-1,-1,1],[-1,1,1],[1,-1,-1]